<?xml version="1.0" encoding="UTF-8"?>
<xs:schema xmlns:xs="http://www.w3.org/2001/XMLSchema">
    <xs:element name="travelBooking">
        <xs:complexType>
            <xs:sequence>
                <xs:element name="booking" maxOccurs="unbounded">
                    <xs:complexType>
                        <xs:sequence>
                            <xs:element name="traveler">
                                <xs:complexType>
                                    <xs:sequence>
                                        <xs:element name="name" type="xs:string"/>
                                        <xs:element name="contact" type="xs:string"/>
                                    </xs:sequence>
                                </xs:complexType>
                            </xs:element>
                            <xs:element name="flight">
                                <xs:complexType>
                                    <xs:sequence>
                                        <xs:element name="airline" type="xs:string"/>
                                        <xs:element name="date" type="xs:date"/>
                                        <xs:element name="route">
                                            <xs:complexType>
                                                <xs:sequence>
                                                    <xs:element name="from" type="xs:string"/>
                                                    <xs:element name="to" type="xs:string"/>
                                                </xs:sequence>
                                            </xs:complexType>
                                        </xs:element>
                                    </xs:sequence>
                                </xs:complexType>
                            </xs:element>
                            <xs:element name="price">
                                <xs:simpleType>
                                    <xs:restriction base="xs:decimal">
                                        <xs:minInclusive value="100"/>
                                        <xs:maxInclusive value="10000"/>
                                    </xs:restriction>
                                </xs:simpleType>
                            </xs:element>
                            <xs:element name="bookingID">
                                <xs:simpleType>
                                    <xs:restriction base="xs:string">
                                        <xs:pattern value="[A-Z]{2}[0-9]{4}"/>
                                    </xs:restriction>
                                </xs:simpleType>
                            </xs:element>
                        </xs:sequence>
                    </xs:complexType>
                </xs:element>
            </xs:sequence>
        </xs:complexType>
    </xs:element>
</xs:schema>
